{
  "anchors": [
    {
      "anchor": true,
      "href": "https://github.com/SGit-AI/SGit-AI__Website__Secrets/commit/05ebf4d0565e9e8d8084136b422646afafbb9711",
      "id": "anchor.commit.05ebf4d0565e9e8d8084136b422646afafbb9711",
      "kind": "commit",
      "name": "commit 05ebf4d",
      "opens": "on GitHub",
      "ref": "commit:05ebf4d0565e9e8d8084136b422646afafbb9711"
    },
    {
      "anchor": true,
      "href": "https://github.com/SGit-AI/SGit-AI__Website__Secrets/commit/06b492182ff8106fd40caffc56f27e2a56db7613",
      "id": "anchor.commit.06b492182ff8106fd40caffc56f27e2a56db7613",
      "kind": "commit",
      "name": "commit 06b4921",
      "opens": "on GitHub",
      "ref": "commit:06b492182ff8106fd40caffc56f27e2a56db7613"
    },
    {
      "anchor": true,
      "href": "https://github.com/SGit-AI/SGit-AI__Website__Secrets/commit/306aa0c2e9d22366b748390be06e13eb93599152",
      "id": "anchor.commit.306aa0c2e9d22366b748390be06e13eb93599152",
      "kind": "commit",
      "name": "commit 306aa0c",
      "opens": "on GitHub",
      "ref": "commit:306aa0c2e9d22366b748390be06e13eb93599152"
    },
    {
      "anchor": true,
      "href": "https://github.com/SGit-AI/SGit-AI__Website__Secrets/commit/33fce58f68451cb7cc2106acdec7a44d0fb833dd",
      "id": "anchor.commit.33fce58f68451cb7cc2106acdec7a44d0fb833dd",
      "kind": "commit",
      "name": "commit 33fce58",
      "opens": "on GitHub",
      "ref": "commit:33fce58f68451cb7cc2106acdec7a44d0fb833dd"
    },
    {
      "anchor": true,
      "href": "https://github.com/SGit-AI/SGit-AI__Website__Secrets/commit/72acdf7a1e0128e28e169a9291c254a6946666fe",
      "id": "anchor.commit.72acdf7a1e0128e28e169a9291c254a6946666fe",
      "kind": "commit",
      "name": "commit 72acdf7",
      "opens": "on GitHub",
      "ref": "commit:72acdf7a1e0128e28e169a9291c254a6946666fe"
    },
    {
      "anchor": true,
      "href": "https://github.com/SGit-AI/SGit-AI__Website__Secrets/commit/8ece6167362164eb5cfd4fcab4f5e2189b02a2cb",
      "id": "anchor.commit.8ece6167362164eb5cfd4fcab4f5e2189b02a2cb",
      "kind": "commit",
      "name": "commit 8ece616",
      "opens": "on GitHub",
      "ref": "commit:8ece6167362164eb5cfd4fcab4f5e2189b02a2cb"
    },
    {
      "anchor": true,
      "href": "https://github.com/SGit-AI/SGit-AI__Website__Secrets/commit/a110792ec5f224319836c3adc8ebf7b440cd0d08",
      "id": "anchor.commit.a110792ec5f224319836c3adc8ebf7b440cd0d08",
      "kind": "commit",
      "name": "commit a110792",
      "opens": "on GitHub",
      "ref": "commit:a110792ec5f224319836c3adc8ebf7b440cd0d08"
    },
    {
      "anchor": true,
      "href": "https://github.com/SGit-AI/SGit-AI__Website__Secrets/commit/caefd5ec992e905f00cb54ed1b77e5db6cb09c07",
      "id": "anchor.commit.caefd5ec992e905f00cb54ed1b77e5db6cb09c07",
      "kind": "commit",
      "name": "commit caefd5e",
      "opens": "on GitHub",
      "ref": "commit:caefd5ec992e905f00cb54ed1b77e5db6cb09c07"
    },
    {
      "anchor": true,
      "href": "https://github.com/SGit-AI/SGit-AI__Website__Secrets/commit/e031a3f01779e298eb4cabe48e779cd7afd5b04a",
      "id": "anchor.commit.e031a3f01779e298eb4cabe48e779cd7afd5b04a",
      "kind": "commit",
      "name": "commit e031a3f",
      "opens": "on GitHub",
      "ref": "commit:e031a3f01779e298eb4cabe48e779cd7afd5b04a"
    },
    {
      "anchor": true,
      "href": "/docs/design/brief-corrections.html#c16-the-admin-section-and-the-markdown-viewer-follow-the-siblings",
      "id": "anchor.doc.docs/design/brief-corrections.md@c16-the-admin-section-and-the-markdown-viewer-follow-the-siblings",
      "kind": "doc",
      "name": "docs/design/brief-corrections.md #c16-the-admin-section-and-the-markdown-viewer-follow-the-siblings",
      "opens": "the rendered page",
      "ref": "doc:docs/design/brief-corrections.md#c16-the-admin-section-and-the-markdown-viewer-follow-the-siblings"
    },
    {
      "anchor": true,
      "href": "/docs/design/brief-corrections.html#c18-the-site-has-four-themes-and-the-theme-key-holds-a-name-not-light-or-dark",
      "id": "anchor.doc.docs/design/brief-corrections.md@c18-the-site-has-four-themes-and-the-theme-key-holds-a-name-not-light-or-dark",
      "kind": "doc",
      "name": "docs/design/brief-corrections.md #c18-the-site-has-four-themes-and-the-theme-key-holds-a-name-not-light-or-dark",
      "opens": "the rendered page",
      "ref": "doc:docs/design/brief-corrections.md#c18-the-site-has-four-themes-and-the-theme-key-holds-a-name-not-light-or-dark"
    },
    {
      "anchor": true,
      "href": "/docs/design/brief-corrections.html#c19-one-page-widens-the-content-security-policy-declared-in-its-head-marker",
      "id": "anchor.doc.docs/design/brief-corrections.md@c19-one-page-widens-the-content-security-policy-declared-in-its-head-marker",
      "kind": "doc",
      "name": "docs/design/brief-corrections.md #c19-one-page-widens-the-content-security-policy-declared-in-its-head-marker",
      "opens": "the rendered page",
      "ref": "doc:docs/design/brief-corrections.md#c19-one-page-widens-the-content-security-policy-declared-in-its-head-marker"
    },
    {
      "anchor": true,
      "href": "/docs/design/brief-corrections.html#c22-the-mockups-are-a-prototype-in-three-ux-variants-with-a-column",
      "id": "anchor.doc.docs/design/brief-corrections.md@c22-the-mockups-are-a-prototype-in-three-ux-variants-with-a-column",
      "kind": "doc",
      "name": "docs/design/brief-corrections.md #c22-the-mockups-are-a-prototype-in-three-ux-variants-with-a-column",
      "opens": "the rendered page",
      "ref": "doc:docs/design/brief-corrections.md#c22-the-mockups-are-a-prototype-in-three-ux-variants-with-a-column"
    },
    {
      "anchor": true,
      "href": "/docs/design/brief-corrections.html#c23-everything-links-to-everything-claims-anchors-and-the-brief-as-sections",
      "id": "anchor.doc.docs/design/brief-corrections.md@c23-everything-links-to-everything-claims-anchors-and-the-brief-as-sections",
      "kind": "doc",
      "name": "docs/design/brief-corrections.md #c23-everything-links-to-everything-claims-anchors-and-the-brief-as-sections",
      "opens": "the rendered page",
      "ref": "doc:docs/design/brief-corrections.md#c23-everything-links-to-everything-claims-anchors-and-the-brief-as-sections"
    },
    {
      "anchor": true,
      "href": "/docs/ops/bootstrap.html",
      "id": "anchor.doc.docs/ops/bootstrap.md",
      "kind": "doc",
      "name": "docs/ops/bootstrap.md",
      "opens": "the rendered page",
      "ref": "doc:docs/ops/bootstrap.md"
    },
    {
      "anchor": true,
      "href": "/docs/ops/branch-protection.html",
      "id": "anchor.doc.docs/ops/branch-protection.md",
      "kind": "doc",
      "name": "docs/ops/branch-protection.md",
      "opens": "the rendered page",
      "ref": "doc:docs/ops/branch-protection.md"
    },
    {
      "anchor": true,
      "href": "/docs/ops/comms.html",
      "id": "anchor.doc.docs/ops/comms.md",
      "kind": "doc",
      "name": "docs/ops/comms.md",
      "opens": "the rendered page",
      "ref": "doc:docs/ops/comms.md"
    },
    {
      "anchor": true,
      "href": "/docs/ops/dns.html",
      "id": "anchor.doc.docs/ops/dns.md",
      "kind": "doc",
      "name": "docs/ops/dns.md",
      "opens": "the rendered page",
      "ref": "doc:docs/ops/dns.md"
    },
    {
      "anchor": true,
      "href": "/docs/ops/release.html",
      "id": "anchor.doc.docs/ops/release.md",
      "kind": "doc",
      "name": "docs/ops/release.md",
      "opens": "the rendered page",
      "ref": "doc:docs/ops/release.md"
    },
    {
      "anchor": true,
      "href": "/keyring/index.html",
      "id": "anchor.doc.keyring/index.html",
      "kind": "doc",
      "name": "keyring/index.html",
      "opens": "the rendered page",
      "ref": "doc:keyring/index.html"
    },
    {
      "anchor": true,
      "href": "/review/BRIEF-CORRECTIONS.md",
      "id": "anchor.doc.review/BRIEF-CORRECTIONS.md",
      "kind": "doc",
      "name": "review/BRIEF-CORRECTIONS.md",
      "opens": "the rendered page",
      "ref": "doc:review/BRIEF-CORRECTIONS.md"
    },
    {
      "anchor": true,
      "href": "/review/README.md",
      "id": "anchor.doc.review/README.md",
      "kind": "doc",
      "name": "review/README.md",
      "opens": "the rendered page",
      "ref": "doc:review/README.md"
    },
    {
      "anchor": true,
      "href": "/review/ui/README.md",
      "id": "anchor.doc.review/ui/README.md",
      "kind": "doc",
      "name": "review/ui/README.md",
      "opens": "the rendered page",
      "ref": "doc:review/ui/README.md"
    },
    {
      "anchor": true,
      "href": "/sharing/index.html",
      "id": "anchor.doc.sharing/index.html",
      "kind": "doc",
      "name": "sharing/index.html",
      "opens": "the rendered page",
      "ref": "doc:sharing/index.html"
    },
    {
      "anchor": true,
      "href": "https://github.com/SGit-AI/SGit-AI__Website__Secrets/blob/dev/.github/workflows/deploy-pages.yml",
      "id": "anchor.file..github/workflows/deploy-pages.yml",
      "kind": "file",
      "name": ".github/workflows/deploy-pages.yml",
      "opens": "on GitHub (not served by the site)",
      "ref": "file:.github/workflows/deploy-pages.yml"
    },
    {
      "anchor": true,
      "href": "/review/ui/#file=.well-known/sgit-agents.json",
      "id": "anchor.file..well-known/sgit-agents.json",
      "kind": "file",
      "name": ".well-known/sgit-agents.json",
      "opens": "in the navigator",
      "ref": "file:.well-known/sgit-agents.json"
    },
    {
      "anchor": true,
      "href": "/review/ui/#file=CNAME",
      "id": "anchor.file.CNAME",
      "kind": "file",
      "name": "CNAME",
      "opens": "in the navigator",
      "ref": "file:CNAME"
    },
    {
      "anchor": true,
      "href": "/review/ui/#file=about/participant.html",
      "id": "anchor.file.about/participant.html",
      "kind": "file",